ID;brand;numSimultCups;purDate;descr
66d7d825-2256-4533-ad9b-385edfee0539;Jura;1;2019-07-19 11:1:1.1;No screen, only character indicators. Key management, part of the keys and several leds hidden behind the door on the front pane
98e19559-ad28-40af-85d6-e07488cbe13e;Miele;2;2019-07-18 11:1:1.1;Can be attributed to the technique of premium. Large selection of drinks, flexible configuration of each drink.
73a9104c-8e94-4e96-ae08-0fbe2047ceac;De'Longhi;3;2019-07-17 11:1:1.1;Perhaps the best coffee machine for lovers of cappuccino. The LatteCrema Embedded System monitors the ideal temperature of the m
143e86a2-58dc-46e3-b57e-4557b48fa428;Philips;4;2019-07-16 11:1:1.1;For relatively little money, you get branded removable brewing unit with pre-wetting, which is easy to clean, and he brews coffe
ab5171bf-a46d-4b1b-9434-0648753b44ef;Siemens;5;2019-07-15 11:1:1.1;The machine is quiet, compact and stylish. Prepares drinks in one click from the control panel, the coffee is tasty and pleasant
